{"artifact":{"chart":"trivy-operator","repository":"aqua","type":"helm","version":"0.36.0"},"category":"security","compatibility":{"kubernetes":">=1.31.0 <1.36.0"},"defaultEnabled":false,"documentation":"https://aquasecurity.github.io/trivy-operator/latest/","home":"https://github.com/aquasecurity/trivy-operator","icon":"https://raw.githubusercontent.com/aquasecurity/trivy/main/docs/imgs/logo.png","keywords":["trivy","vulnerability","compliance"],"lifecycle":{"install":true,"rollback":true,"uninstall":true,"upgrade":true},"name":"Trivy Operator","privileged":true,"resources":{"profile":"medium"},"slug":"trivy-operator","storage":{"required":false},"summary":"Kubernetes-native vulnerability and configuration scanning with Trivy.","supportTier":"upstream","ui":{"configurationMode":"schema-and-yaml","featured":true,"sections":["scanners","reports","operator","resources"]}}
