{"artifact":{"chart":"ingress-nginx","repository":"ingress-nginx","type":"helm","version":"4.15.1"},"category":"networking","compatibility":{"kubernetes":">=1.31.0 <1.36.0"},"defaultEnabled":false,"documentation":"https://kubernetes.github.io/ingress-nginx/deploy/","home":"https://kubernetes.github.io/ingress-nginx/","icon":"https://cdn.simpleicons.org/nginx/009639","keywords":["ingress","nginx","load-balancer"],"lifecycle":{"install":true,"rollback":true,"uninstall":true,"upgrade":true},"name":"Ingress NGINX","privileged":true,"resources":{"profile":"medium"},"slug":"ingress-nginx","storage":{"required":false},"summary":"NGINX-based Kubernetes ingress controller.","supportTier":"upstream","ui":{"configurationMode":"schema-and-yaml","featured":true,"sections":["controller","service","tls","autoscaling","resources"]}}
