{"artifact":{"chart":"kube-state-metrics","repository":"prometheus-community","type":"helm","version":"8.4.0"},"category":"monitoring","compatibility":{"kubernetes":">=1.31.0 <1.36.0"},"defaultEnabled":true,"documentation":"https://github.com/kubernetes/kube-state-metrics/tree/main/docs","home":"https://github.com/kubernetes/kube-state-metrics","icon":"https://raw.githubusercontent.com/kubernetes/kubernetes/master/logo/logo.svg","keywords":["kubernetes","metrics","inventory"],"lifecycle":{"install":true,"rollback":true,"uninstall":true,"upgrade":true},"name":"Kube State Metrics","privileged":false,"resources":{"profile":"small"},"slug":"kube-state-metrics","storage":{"required":false},"summary":"Cluster object-state metrics for Astronomer dashboards and Prometheus.","supportTier":"astronomer","ui":{"configurationMode":"schema-and-yaml","featured":true,"sections":["general","metrics","resources","scheduling"]}}
