{"artifact":{"chart":"tempo","repository":"grafana","type":"helm","version":"1.24.4"},"category":"monitoring","compatibility":{"kubernetes":">=1.31.0 <1.36.0"},"defaultEnabled":false,"description":"Store and query OpenTelemetry and Jaeger traces with object-storage integration and Grafana correlation.","documentation":"https://grafana.com/docs/tempo/latest/setup/helm-chart/","home":"https://grafana.com/oss/tempo/","icon":"https://cdn.simpleicons.org/grafana/F46800","keywords":["traces","opentelemetry","grafana","observability"],"lifecycle":{"install":true,"rollback":true,"uninstall":true,"upgrade":true},"name":"Grafana Tempo","privileged":false,"resources":{"profile":"medium"},"slug":"tempo","storage":{"recommended":"50Gi","required":true},"summary":"High-scale distributed tracing backend from Grafana Labs.","supportTier":"upstream","ui":{"configurationMode":"schema-and-yaml","featured":true,"sections":["receivers","storage","retention","service","resources"]}}
