{"artifact":{"chart":"external-secrets","repository":"external-secrets","type":"helm","version":"2.9.0"},"category":"security","compatibility":{"kubernetes":">=1.31.0 <1.36.0"},"defaultEnabled":false,"description":"Connect Kubernetes workloads to AWS Secrets Manager, Azure Key Vault, Google Secret Manager, Vault, and other supported providers.","documentation":"https://external-secrets.io/latest/introduction/getting-started/","home":"https://external-secrets.io/","icon":"https://raw.githubusercontent.com/external-secrets/external-secrets/main/assets/eso-round-logo.svg","keywords":["secrets","vault","aws","azure","gcp"],"lifecycle":{"install":true,"rollback":true,"uninstall":true,"upgrade":true},"name":"External Secrets Operator","privileged":true,"resources":{"profile":"medium"},"slug":"external-secrets","storage":{"required":false},"summary":"Synchronize secrets from external providers into Kubernetes.","supportTier":"upstream","ui":{"configurationMode":"schema-and-yaml","featured":true,"sections":["crds","webhook","cert-controller","resources"]}}
