{"artifact":{"chart":"gatekeeper","repository":"gatekeeper","type":"helm","version":"3.23.0"},"category":"security","compatibility":{"kubernetes":">=1.31.0 <1.36.0"},"defaultEnabled":false,"description":"Enforce reusable constraints on Kubernetes resources and report policy violations.","documentation":"https://open-policy-agent.github.io/gatekeeper/website/docs/install/","home":"https://open-policy-agent.github.io/gatekeeper/website/","icon":"https://cdn.simpleicons.org/openpolicyagent/7D9199","keywords":["opa","policy","admission","compliance"],"lifecycle":{"install":true,"rollback":true,"uninstall":true,"upgrade":true},"name":"OPA Gatekeeper","privileged":true,"resources":{"profile":"medium"},"slug":"gatekeeper","storage":{"required":false},"summary":"Admission control and policy enforcement powered by Open Policy Agent.","supportTier":"upstream","ui":{"configurationMode":"schema-and-yaml","featured":true,"sections":["admission","audit","mutation","resources"]}}
